{
  "event_id": "0b6f9d0e-3c1a-4f5e-9a51-2a7f3c1d8e01",
  "event_type": "session.started",
  "event_version": 1,
  "occurred_at": "2026-10-05T09:00:00+05:00",
  "source": "scheduling",
  "session_id": "5d2b7c4a-8e9f-4a1b-b3c6-7d8e9f0a1b2c",
  "student_id": "9a8b7c6d-5e4f-4a3b-8c2d-1e0f9a8b7c6d",
  "payload": {
    "entry": "scheduled",
    "concept_id": "math_g3_m5_l1_partition_whole_unit_fractions_concrete",
    "card_version": 1
  }
}
