{
  "event_id": "1c7a0e1f-4d2b-4a6f-8b62-3b8a4d2e9f02",
  "event_type": "session.ended",
  "event_version": 1,
  "occurred_at": "2026-10-05T09:40:00+05:00",
  "source": "scheduling",
  "session_id": "5d2b7c4a-8e9f-4a1b-b3c6-7d8e9f0a1b2c",
  "student_id": "9a8b7c6d-5e4f-4a3b-8c2d-1e0f9a8b7c6d",
  "payload": { "reason": "completed" }
}
